docid	title	curid	revid	url	text_md5
ta-6340	லைபீரிய அதிபர் உட்பட மூன்று பெண்களுக்கு 2011 நோபல் அமைதிப் பரிசு	6340	49296	https://ta.wikinews.org/wiki?curid=6340	9a797fa956cb63dc480f9181e6a33216
ta-6342	இலங்கை உள்ளூராட்சித் தேர்தல் 2011: மூன்றாம் கட்டத் தேர்தல் ஆரம்பம்	6342	49298	https://ta.wikinews.org/wiki?curid=6342	d8b4c3c899be3b99c988a2ecc3dab13f
ta-6362	"அமெரிக்காவில் ""வால் ஸ்ட்ரீட் ஆக்கிரமிப்பு"" போராட்டங்கள் நாடெங்கும் பரவியது"	6362	49305	https://ta.wikinews.org/wiki?curid=6362	ab2e0e53fde9591987a35e0cfd146ee7
ta-6364	அமெரிக்கப் பேராசிரியர்கள் இருவருக்கு பொருளியலுக்கான நோபல் பரிசு	6364	49306	https://ta.wikinews.org/wiki?curid=6364	f3547409b45e408ce5bff22ba0a3bd3f
ta-6367	பர்மா ஆறாயிரத்துக்கும் அதிகமான கைதிகளை விடுவிக்கிறது	6367	49307	https://ta.wikinews.org/wiki?curid=6367	8f43dd45a48eb4f4f485fa33b2913244
ta-6373	சீன நாணயத்திற்கு எதிரான சட்டமுன்வரைவு அமெரிக்க மேலவையில் நிறைவேற்றம்	6373	49309	https://ta.wikinews.org/wiki?curid=6373	a3e7a38e2b6b8642dca1de152da17b62
ta-6376	பங்கு மோசடியில் ஈடுபட்ட ராஜ் ராஜரத்தினத்திற்கு 11 ஆண்டுகள் சிறைத்தண்டனை	6376	49310	https://ta.wikinews.org/wiki?curid=6376	295aca07634505a3f307ea0808c53505
ta-6378	பப்புவா நியூ கினியில் விமானம் வீழ்ந்து நொறுங்கியதில் 28 பேர் உயிரிழப்பு	6378	49311	https://ta.wikinews.org/wiki?curid=6378	75ac04544a5119ba7afa0d25ba56a88a
ta-6385	பர்மாவில் தொழிற்சங்கங்கள் அமைக்க அனுமதி	6385	49316	https://ta.wikinews.org/wiki?curid=6385	17ef65572701f6cc07b9687da0865552
ta-6445	அமெரிக்க இராசாங்கத் திணைக்களத்தில் தமிழ்த் தேசியக் கூட்டமைப்பு பேச்சுவார்த்தை	6445	49340	https://ta.wikinews.org/wiki?curid=6445	300c62a07ff77e0f009314b949006c6e
ta-6446	ராஜ் ராஜரத்தினத்துடன் இணைந்து பங்கு மோசடியில் ஈடுபட்ட ரஜத் குப்தா கைது	6446	49341	https://ta.wikinews.org/wiki?curid=6446	42c53d1cc9619c6c8328e75fb4a30035
ta-6459	அக்டோபர் 31 இல் பிறந்த எந்தக் குழந்தையும் 700 கோடியாவது குழந்தையே, ஐநா அறிவிப்பு	6459	49348	https://ta.wikinews.org/wiki?curid=6459	2202b5a40382673e170c8b6d433d39ad
ta-6657	துடுப்பாட்ட சூதாட்டக் குற்றச்சாட்டில் பாக்கித்தான் வீரர்கள் மூவருக்கு லண்டனில் சிறை	6657	49353	https://ta.wikinews.org/wiki?curid=6657	dee9f93326a21e0e21a1264ca55f0215
ta-6681	2018 பொதுநலவாயப் போட்டிகளை நடத்தும் உரிமையை கோல்ட் கோஸ்ட் நகரம் வென்றது	6681	49365	https://ta.wikinews.org/wiki?curid=6681	4604d9aef83dcc3fa99873809eeab63d
ta-6708	ஆங் சான் சூச்சியின் சனநாயகக் கட்சி அரசியலில் இணைய முடிவு	6708	49379	https://ta.wikinews.org/wiki?curid=6708	a3058c1ade5c807ca1224b40dd4f9ee4
ta-6720	டேம் 999 ஆங்கிலத் திரைப்படத்துக்கு தமிழ்நாட்டில் எதிர்ப்பு	6720	49384	https://ta.wikinews.org/wiki?curid=6720	9f8f79a8a040fd00f67493c42e264c2a
ta-6757	மைக்கல் ஜாக்சனின் இறப்புக்குக் காரணமான மருத்துவருக்கு 4 ஆண்டு சிறை	6757	49400	https://ta.wikinews.org/wiki?curid=6757	29fda9448856761696b5622cd6ee40a1
ta-6785	பன்னாட்டு ஒருநாள் துடுப்பாட்டப் போட்டியில் வீரேந்தர் சேவாக் உலக சாதனை	6785	49414	https://ta.wikinews.org/wiki?curid=6785	629ac5e0c112f4c4effd99ed0afd5e8f
ta-6789	கொங்கோ மக்களாட்சிக் குடியரசு அரசுத்தலைவர் தேர்தலில் ஜோசப் கபிலா வெற்றி	6789	49417	https://ta.wikinews.org/wiki?curid=6789	f13f31cfb1958a6add3d0477bb1d1068
ta-6831	அதிமுகவிலிருந்து சசிகலா குடும்பத்தினர் நீக்கப்படுவதாக செயலாளர் ஜெயலலிதா அறிவிப்பு	6831	49437	https://ta.wikinews.org/wiki?curid=6831	e7235cb30cdf8a1c13d61906e68a0e4a
ta-6851	பர்மாவின் ஆங் சான் சூச்சியின் கட்சி மீண்டும் அரசியல் கட்சியாகப் பதிவு	6851	49446	https://ta.wikinews.org/wiki?curid=6851	ee20247bd8409fad138117e1b7b47ef8
ta-6873	மகேல ஜயவர்தன தேர்வுப் போட்டிகளில் 10 ஆயிரம் ஓட்டங்களைக் கடந்த முதல் இலங்கை வீரானார்	6873	49453	https://ta.wikinews.org/wiki?curid=6873	b57ef35d1b10673aaf8fe9b3dd7a33e2
ta-6875	இங்கிலாந்தில் இந்திய மாணவன் படுகொலை	6875	49454	https://ta.wikinews.org/wiki?curid=6875	9ecfbb6ae22afa3bca16244ee4cbc1e5
ta-6913	கொங்கோவில் ருவாண்டா போராளிகளின் தாக்குதலில் 26 பேர் உயிரிழப்பு	6913	49476	https://ta.wikinews.org/wiki?curid=6913	ed639cdb0fa01de04814f9befdaceab4
ta-6918	ஈரானிய எண்ணெய்க்கு தடைவிதிக்க ஐரோப்பிய ஒன்றியம் கொள்கை அளவில் ஒப்புதல்	6918	49480	https://ta.wikinews.org/wiki?curid=6918	637ee8ce909e851a7c81ec8818567dba
ta-6956	காரென் போராளிகளுடன் பர்மிய அரசு போர்நிறுத்த உடன்பாடு	6956	49500	https://ta.wikinews.org/wiki?curid=6956	a03aacea5a4272cbfa1acf843efd36ce
ta-6977	வலைத்தடக் கொள்ளைத் தடைச் சட்டமூலத்துக்கு எதிராக விக்கிப்பீடியா குரல்	6977	49510	https://ta.wikinews.org/wiki?curid=6977	4b858b4b4393ab298c8ffbfbe634956e
ta-6988	பர்மிய இடைத்தேர்தலில் போட்டியிட ஆங் சான் சூச்சி பதிவு	6988	49513	https://ta.wikinews.org/wiki?curid=6988	cfc5d857800e0876cf45692e32aa4246
ta-10621	பிரெஞ்சு இரீயூனியன் தீவை சூறாவளி பெஜிசா தாக்கியது, பெரும் சேதம்	10621	50525	https://ta.wikinews.org/wiki?curid=10621	29e75ab7c93025ee3e523f4ff2aebd97
ta-10713	இந்தியத் துடுப்பாட்ட அணித் தலைவர் டோனி, ஒருநாள் போட்டிகளில் 8,000 ஓட்டங்களைக் கடந்தார்	10713	50564	https://ta.wikinews.org/wiki?curid=10713	866decfba3fb50a5765784128b81fc8e
ta-10764	லண்டனில் பல்லின இசைக்குழுவின் இசைநிகழ்ச்சி	10764	50589	https://ta.wikinews.org/wiki?curid=10764	7e8b992620b1be63add656f7ad9ddf62
ta-10786	துடுப்பாட்டம்: இலங்கை அணி ஆசியக் கோப்பையை வென்றது	10786	50600	https://ta.wikinews.org/wiki?curid=10786	290eadde7d7be299cb9734f3672d02dd
ta-11065	முல்லைப் பெரியாறு அணை விவகாரத்தில் உச்ச நீதிமன்றம் தீர்ப்பு வழங்கியுள்ளது	11065	50648	https://ta.wikinews.org/wiki?curid=11065	33b3995927b3b80a487c2875d823061e
ta-11350	2014 உலகக் கிண்ணக் கால்பந்துப் போட்டி பிரேசிலில் ஆரம்பமானது	11350	50688	https://ta.wikinews.org/wiki?curid=11350	e8d002413711ecc1acfe66920eb5ed6f
ta-11353	2014 உலகக்கிண்ணக் கால்பந்து: நெதர்லாந்திடம் நடப்பு உலக வாகையர் எசுப்பானியா தோல்வி	11353	50689	https://ta.wikinews.org/wiki?curid=11353	f1862f5549174e1533302fdba7e7fd1d
ta-11393	2014 கால்பந்து உலகக்கிண்ணம்: பிரேசில் அரையிறுதியில் செருமனியிடம் 1:7 கணக்கில் தோற்றது	11393	50707	https://ta.wikinews.org/wiki?curid=11393	9919a18de2885aaec74509152f9fa97f
ta-11396	2014 உலகக்கோப்பை காற்பந்து: செருமனி நான்காவது தடவையாக உலகக்கோப்பையை வென்றது	11396	50709	https://ta.wikinews.org/wiki?curid=11396	109e250580c987fe644c2123337ff763
ta-12394	அப்துல்கலாம் இயற்கை எய்தினார்	12394	50773	https://ta.wikinews.org/wiki?curid=12394	b0b8ca5a648d2aa421b077aae516091c
ta-7032	2012 ஆஸ்திரேலிய திறந்த சுற்று இறுதிப் போட்டியில் விக்டோரியா அசரென்கா வெற்றி	7032	49537	https://ta.wikinews.org/wiki?curid=7032	ea3e8bd783479e5608889998935ecb1b
ta-7042	2012 ஆஸ்திரேலிய திறந்த சுற்று ஆண்கள் இறுதிப் போட்டியில் ஜோக்கொவிச் வெற்றி	7042	49540	https://ta.wikinews.org/wiki?curid=7042	681ee6a6f09bba009acc761b545f8440
ta-7060	சிரியா தொடர்பான ஐநா தீர்மானத்திற்கு எதிராக உருசியா, சீனா வீட்டோ	7060	49552	https://ta.wikinews.org/wiki?curid=7060	d195c5aad33beadab48a85f641f4de6e
ta-7091	கொங்கோ விமான விபத்தில் அரசுத்தலைவர் கபிலாவின் மூத்த ஆலோசகர் உயிரிழப்பு	7091	49568	https://ta.wikinews.org/wiki?curid=7091	e178f257298b569fdbc8d3799be5a6eb
ta-7138	ஆத்திரேலிய முன்னாள் அணித்தலைவர் ரிக்கி பாண்டிங் ஒரு நாள் போட்டிகளிலிருந்து ஓய்வு பெற்றார்	7138	49589	https://ta.wikinews.org/wiki?curid=7138	60825efe0e400b4d7b50f0639256cc90
ta-7170	2012 லண்டன் ஒலிம்பிக் போட்டியை இந்தியா புறக்கணிக்காது, இந்திய ஒலிம்பிக் சங்கம் அறிவிப்பு	7170	49607	https://ta.wikinews.org/wiki?curid=7170	6310fee9ff7a7582d05034066199cfdd
ta-7183	ஆத்திரேலிய முத்தரப்புத் தொடரில் ஆத்திரேலியா, இலங்கை அணிகள் இறுதிப் போட்டிக்குத் தகுதி	7183	49611	https://ta.wikinews.org/wiki?curid=7183	5c872f2a416254e146a5fdd647ac60c9
ta-7186	அமெரிக்காவின் மத்திய மேற்கு மாநிலங்களில் பலத்த சூறாவளி, 37 பேர் உயிரிழப்பு	7186	49612	https://ta.wikinews.org/wiki?curid=7186	c80c0875e835f2bd9668cf0d0fc03b01
ta-7401	2012 ஆசியக் கோப்பை துடுப்பாட்டத் தொடர் வங்காளதேசத்தில் ஆரம்பம்	7401	49627	https://ta.wikinews.org/wiki?curid=7401	5b0d679a8a5a945de5e6f17d12e01bb4
ta-7411	பிரித்தானிக்கா கலைக்களஞ்சியம் தனது அச்சுப் பதிப்பை நிறுத்திக் கொண்டது	7411	49633	https://ta.wikinews.org/wiki?curid=7411	8d0ad67166ac85ea8915a1a416169986
ta-7417	பன்னாட்டுப் போட்டிகளில் நூறாவது சதமடித்து சாதனை படைத்தார் சச்சின் டெண்டுல்கர்	7417	49637	https://ta.wikinews.org/wiki?curid=7417	94f5b271cf1f6fcd3e8d22e3a785d715
ta-7443	இலங்கை தொடர்பான அமெரிக்கப் பிரேரணை ஐநா மனித உரிமைகள் பேரவையில் நிறைவேறியது	7443	49649	https://ta.wikinews.org/wiki?curid=7443	130c121119ecfa1d77f01a234577e233
ta-7447	2012 ஆசியக் கிண்ணத்தை பாக்கித்தான் அணி வென்றது	7447	49650	https://ta.wikinews.org/wiki?curid=7447	bae37987e144843965f7530628a5a563
ta-7492	பர்மிய அரசுத்தலைவர் காரென் போராளிகளுடன் சந்திப்பு	7492	49674	https://ta.wikinews.org/wiki?curid=7492	0eadc5513490a21d22acdf74d8c16a4c
ta-7543	ஆப்கானித்தானில் இருந்து 2013 இற்குள் படையினரை மீள அழைக்க ஆத்திரேலியா முடிவு	7543	49697	https://ta.wikinews.org/wiki?curid=7543	a84d49a0ff2bce6cb1aef479ce9b2032
ta-7548	நாட்சிகளினால் அபகரிக்கப்பட்ட 474-ஆண்டு பழமையான ஓவியம் உரிமையாளரின் வாரிசுகளிடம் ஒப்படைப்பு	7548	49699	https://ta.wikinews.org/wiki?curid=7548	0f05cd6447eb31c3deb5a7c92ff0f0d1
ta-7641	2012 உலக சதுரங்கப் போட்டித் தொடரின் ஏழாவது ஆட்டத்தில் விசுவநாதன் ஆனந்த் தோல்வி	7641	49748	https://ta.wikinews.org/wiki?curid=7641	ffcf9322db3b7b99539732ae9159cdce
ta-7651	அஸ்லான்ஷா கோப்பை ஹாக்கி முதல் சுற்றில் இந்தியா நியூசிலாந்திடம் தோல்வி	7651	49753	https://ta.wikinews.org/wiki?curid=7651	fa6d1316a3f2133bd3520b4161503373
ta-7680	2012 உலக சதுரங்கப் போட்டியில் ‌வி‌சுவநாத‌ன் ஆனந்த் வெற்றி	7680	49764	https://ta.wikinews.org/wiki?curid=7680	ce33cf50bcc72023f6d51a7faf6051ae
ta-7695	2012 வீவா கால்பந்து உலகக்கிண்ணப் போட்டியில் தமிழீழ அணி பங்கேற்கிறது	7695	49770	https://ta.wikinews.org/wiki?curid=7695	2c38ab05709ba8f5e558791ba98ebf1e
ta-7955	யூரோ 2012: ஐரோப்பியக் கால்பந்துக் கிண்ணத்தை எசுப்பானியா வென்றது	7955	49811	https://ta.wikinews.org/wiki?curid=7955	53c4d8887e7f40a71ae3a8471c5c312a
ta-7965	மருசியா எஃப்1 பயிற்சி ஓட்டுனர் மரியா டி விலோட்டா பயிற்சி விபத்தில் கடும் காயம்	7965	49815	https://ta.wikinews.org/wiki?curid=7965	362e4785f5937f4b1ee7070d67284b3f
ta-7984	வரி ஒப்பந்தத்தைத் தக்க வைக்க மொரீசியசு இரண்டு தீவுகளை இந்தியாவுக்கு அளிக்க முன்வந்துள்ளது	7984	49820	https://ta.wikinews.org/wiki?curid=7984	03c4892464ad89f66d5b764c3dd8e730
ta-8002	ரொஜர் பெடரர் 7வது தடவையாக விம்பிள்டன் கோப்பையைக் கைப்பற்றினார்	8002	49826	https://ta.wikinews.org/wiki?curid=8002	b247905fee6b82eb7b67d03ad9e163fc
ta-8027	முன்னாள் ஐநா செயலர் டாக் ஹமாசெல்ட் விமான விபத்தில் இறந்தது குறித்து புதிய விசாரணைகள்	8027	49843	https://ta.wikinews.org/wiki?curid=8027	e1ed830b6d3d06363a1db5ac77f65d96
ta-8054	2012 ஒலிம்பிக் போட்டிகள் இலண்டனில் ஆரம்பமாயின	8054	49856	https://ta.wikinews.org/wiki?curid=8054	261c28a2f6707b14e82c780c2f611b60
ta-8066	2012 ஒலிம்பிக்சு: எட்டு வீராங்கனைகளை உலக இறகுப்பந்தாட்டக் கழகம் தகுதியிழந்ததாக அறிவித்தது	8066	49863	https://ta.wikinews.org/wiki?curid=8066	5c4cc6dcead87c47d14d2a6e38249b8c
ta-8085	2012 ஒலிம்பிக்சு: அமெரிக்காவின் மைக்கேல் பெல்ப்சு 18வது தங்கப்பதக்கம் பெற்று சாதனை படைத்தார்	8085	49868	https://ta.wikinews.org/wiki?curid=8085	453487010a3036496d33311d6c8159a2
ta-8118	விக்கிலீக்ஸ் நிறுவனர் அசான்ச்சிற்கு எக்குவடோர் அரசு புகலிடம் அளித்தது	8118	49881	https://ta.wikinews.org/wiki?curid=8118	9df98a87e536738b746264e435fd9c78
ta-8427	2012 இருபது20 உலகக்கோப்பையை மேற்கிந்தியத் தீவுகள் அணி வென்றது	8427	49956	https://ta.wikinews.org/wiki?curid=8427	d8929ab7b275187eb8761628dc0fd4b8
ta-8431	2012 இயற்பியல் நோபல் பரிசு பிரான்சியருக்கும் அமெரிக்கருக்கும் வழங்கப்பட்டது	8431	49959	https://ta.wikinews.org/wiki?curid=8431	58ae73d131ee115734bb4beae73f7a31
ta-8435	2012 நோபல் அமைதிப் பரிசு ஐரோப்பிய ஒன்றியத்துக்கு வழங்கப்பட்டது	8435	49961	https://ta.wikinews.org/wiki?curid=8435	1d74ef07a7ce4a077210975925b28179
ta-8529	பாலத்தீன நாடு ஐக்கிய நாடுகளின் பார்வையாளர் தகுதியைப் பெற்றது	8529	50015	https://ta.wikinews.org/wiki?curid=8529	a332b4f8742707fc37384690a1a7bdf5
ta-21	சதாம் உசேன் தூக்கிலிடப்பட்டார்	21	38331	https://ta.wikinews.org/wiki?curid=21	9a1738cf215e4897df8e878403a4c392
ta-121	திருக்கோவில் விசேட அதிரடிப்படை முகாம் முற்றாக விலக்கிக் கொள்ளப்பட்டுள்ளது	121	10857	https://ta.wikinews.org/wiki?curid=121	8c246a2d5889a4c8b18b1be2c57698a2
ta-223	போர்க் குற்றங்களுக்காக சூடான் அதிபரைக் கைது செய்ய ஆப்பிரிக்க ஒன்றியம் மறுப்பு	223	48012	https://ta.wikinews.org/wiki?curid=223	af1b10146003561ef54b8ecd1f683471
ta-225	ஈரானில் மேற்குலகத் தலையீடு குறித்து கொமெய்னி எச்சரிக்கை	225	48014	https://ta.wikinews.org/wiki?curid=225	181e10c8a3a06c11c445500e26dbf9cc
ta-236	புவி சூடாதலைக் கட்டுப்படுத்த ஜி-8 நாடுகளின் உடன்பாடு போதாது: ஐ.நா.	236	48022	https://ta.wikinews.org/wiki?curid=236	b68f20baa4c0d800a1ec7c9dbc435fcf
ta-239	நீரிழிவு நோயை உண்டாக்கும் உடல் எடை தெற்காசியர்களுக்கு 'மாறுபடுகிறது'	239	48024	https://ta.wikinews.org/wiki?curid=239	9f6876028bc311b02654959fe75684a9
ta-284	தமிழ்நாட்டில் மேற்குத் தொடர்ச்சி மலைப் பகுதியில் காட்டுத் தீ!	284	48031	https://ta.wikinews.org/wiki?curid=284	833d162a5165c03a99f63ee624e0b74e
ta-287	மூதூர் படுகொலைகளில் இலங்கை இராணுவம் சம்பந்தப்படவில்லை - ஜனாதிபதி ஆணைக்குழு	287	48033	https://ta.wikinews.org/wiki?curid=287	a5edfb6a90e0d9c03585bb1673000b7b
ta-291	போர்க் குற்றங்களுக்காக லைபீரியாவின் முன்னாள் அதிபர் மீது விசாரணைகள் ஆரம்பம்	291	48034	https://ta.wikinews.org/wiki?curid=291	064bb8471d8fdf283cddc775ce5d7c93
ta-294	ரஷ்ய மனித உரிமைச் செயற்பாட்டாளர் கடத்தப்பட்டுப் படுகொலை	294	48035	https://ta.wikinews.org/wiki?curid=294	1e61cbd2ae2bc5f1e1bd5c2d6ed70a80
ta-316	இந்திய இராணுவத்தினர் 500 பேர் இலங்கை வருகின்றனர்	316	48036	https://ta.wikinews.org/wiki?curid=316	9488d72f94a2b56a2e9b09794f5331ac
ta-329	சந்திரயான்-1 விண்கலத்தின் உணர்வீ செயலிழப்பு	329	48037	https://ta.wikinews.org/wiki?curid=329	9979763b4146e8619ac191100afe7496
ta-350	கிழக்கிலங்கையில் செஞ்சிலுவைச் சங்கம் தனது பணிகளை முடித்துக் கொண்டது	350	48041	https://ta.wikinews.org/wiki?curid=350	a68b6d28d1ac836e922adb4a05b8b8ad
ta-353	சகாரா பாலைவனப் பகுதியிலிருந்து சூரிய ஆற்றல் மூலம் ஐரோப்பாவிற்கு மின்சாரம்	353	48043	https://ta.wikinews.org/wiki?curid=353	0fb2276bc441af0095b77cb39ed483f1
ta-355	சமிந்த வாஸ் டெஸ்ட் கிரிக்கெட்டில் இருந்து ஓய்வு பெறுவதாக அறிவிப்பு	355	48044	https://ta.wikinews.org/wiki?curid=355	ed625e9ff9f9b3ef3013c484d8a2c555
ta-359	மும்பை தாக்குதலின் முக்கிய எதிரி குற்றங்களை ஒப்புக் கொண்டார்	359	48046	https://ta.wikinews.org/wiki?curid=359	71752723f097adbfa3bd931d2007fe51
ta-374	வியாழன் கோளில் மோதுகை இடம்பெற்றதை நாசா உறுதிப்படுத்தியது	374	10189	https://ta.wikinews.org/wiki?curid=374	830363ac4ceef1460dac9f7b45c496ff
ta-385	வொக்ஸ்வாகன், போர்ஷ் கார் நிறுவனங்கள் இணைவு	385	48051	https://ta.wikinews.org/wiki?curid=385	0994c4129a4e2b90fb8f5efb52b6e722
ta-389	நிலநடுக்கம் நியூசிலாந்தை ஆஸ்திரேலியா நோக்கி நகர்த்தியது	389	48052	https://ta.wikinews.org/wiki?curid=389	c081ffeac8e4757edb8389eb51eb792c
ta-394	செவ்வாய் கோளுக்கு மனிதர்களை அனுப்புவது தொடர்பான ஆரம்பக்கட்ட பரிசோதனை நிறைவு	394	48053	https://ta.wikinews.org/wiki?curid=394	bc1baccddc200fc3d24e9c4d95be0c99
ta-397	இலங்கையில் உள்ள சுவீடன் தூதரகம் மூடப்படுகிறது	397	48054	https://ta.wikinews.org/wiki?curid=397	1028eb1490edf49c9038df71d933692d
ta-402	இந்தியாவில் புதிய பல்லி இனம் கண்டுபிடிக்கப்பட்டது	402	48056	https://ta.wikinews.org/wiki?curid=402	eabd7b8d0b29d56e689dbb2f0fa52a1a
ta-408	தென்னிலங்கையில் இரு முஸ்லிம் மதக்குழுக்கள் மோதல், 3 பேர் இறப்பு	408	48058	https://ta.wikinews.org/wiki?curid=408	79c4320f48832368fa2ec1ca3d240f6c
