docid	title	curid	revid	url	text_md5
ta-2110	ஷேக்ஸ்பியரினால் எழுதப்பட்டதாகக் கருதப்படும் புதிய நாடகம் வெளியிடப்பட்டது	2110	48310	https://ta.wikinews.org/wiki?curid=2110	ded77fbaeefb62a49c51a6819623b85c
ta-2115	குவாத்தமாலாவின் முன்னாள் தலைவரை அமெரிக்காவுக்கு நாடு கடத்த முடிவு	2115	48311	https://ta.wikinews.org/wiki?curid=2115	66cf11758b557730e79df0bf58a5964f
ta-2118	விடுதலைப் புலிகளின் நினைவுச் சின்னங்கள் அழிக்கப்படும் என இலங்கை அரசு அறிவிப்பு	2118	48312	https://ta.wikinews.org/wiki?curid=2118	da615c3f486d6746deef9d9e2a3251fd
ta-2119	சீனா தனது முதலாவது பயணிகள் உலங்கு வானூர்தியை வெள்ளோட்டம் விட்டது	2119	10026	https://ta.wikinews.org/wiki?curid=2119	df3cb56e7b79ea3b6608fff340673190
ta-2124	லிபியாவுக்கான தனது தூதரை நைஜீரியா திரும்ப அழைத்தது	2124	14428	https://ta.wikinews.org/wiki?curid=2124	0103057c9b7f613313d5c3bd42117c7f
ta-2125	சோயுஸ் விண்கலம் இருவருடன் பாதுகாப்பாகத் திரும்பியது	2125	10028	https://ta.wikinews.org/wiki?curid=2125	24d6b36c5849eb6cc61db6b6ec17d800
ta-2126	கொலம்பியாவில் மனித உரிமை ஆர்வலர் படுகொலை	2126	48313	https://ta.wikinews.org/wiki?curid=2126	57b351490c9fab5432f00a22f69a32fd
ta-2130	நேபாளத்தின் முன்னாள் பிரதமர் கொய்ராலா காலமானார்	2130	14444	https://ta.wikinews.org/wiki?curid=2130	200c75a047e4aa0dc312941da0067072
ta-2131	தெற்கு ஐசுலாந்தில் எரிமலை வெடித்தது	2131	14443	https://ta.wikinews.org/wiki?curid=2131	caa25e656978492a8d72f0da1209774e
ta-2137	தென்னாப்பிரிக்காவில் 1960 சார்ப்வில் படுகொலை நினைவுகூரப்பட்டது	2137	48314	https://ta.wikinews.org/wiki?curid=2137	9942ccc7945cb8c8aa73fded67f64fe2
ta-2141	அமெரிக்க மருத்துவர் பட்டேல் மீது ஆத்திரேலியாவில் கொலைக் குற்றச்சாட்டு	2141	48315	https://ta.wikinews.org/wiki?curid=2141	64d7041961a828c6fafe817f66f14639
ta-2142	கொழும்பில் எம்டிவி தொலைக்காட்சி நிறுவனம் மீது தாக்குதல்	2142	48316	https://ta.wikinews.org/wiki?curid=2142	69178d12f57a350ed151f9d6cbe17ecd
ta-2144	நாசி கொலைக்குற்றவாளிக்கு செருமனி நீதிமன்றம் ஆயுள் தண்டனை விதித்தது	2144	48317	https://ta.wikinews.org/wiki?curid=2144	dda74d77712046c6c4981a0000ca9a83
ta-2145	கல்கத்தாவில் பெரும் தீ விபத்து: 24 பேர் உயிரிழப்பு	2145	48318	https://ta.wikinews.org/wiki?curid=2145	7a89db8ffd12ffdf8701c9f7eb0c0f13
ta-2146	திசைநாயகத்துக்கு சிறந்த வெளிநாட்டு செய்தியாளர் விருது	2146	48319	https://ta.wikinews.org/wiki?curid=2146	3fc83070dd192c30980dbc783849428b
ta-2147	ஆஸ்திரேலியக் காவல்துறையினரின் இனவெறியைத் தூண்டும் மின்னஞ்சல்கள்	2147	48320	https://ta.wikinews.org/wiki?curid=2147	007e65abae3374c8798c63b43cc9030e
ta-2152	வங்கத்தில் 1971 இன் போர்க்குற்ற நீதிமன்றம் அமைக்கப்பட்டது	2152	48321	https://ta.wikinews.org/wiki?curid=2152	c7db70b648fd324dcbec5bbee565167e
ta-2153	இசுலாமுக்கு மதம் மாறிய பெண் இலங்கை அரசுக்கு எதிராகக் குற்றம் புரிந்ததாகக் கைது	2153	13566	https://ta.wikinews.org/wiki?curid=2153	5c845e5a092b32c3ade4bfb998f072af
ta-2156	தென் கொரியக் கடற்படைக் கப்பல் வட கொரிய கடற்பரப்பில் மூழ்கியது	2156	48322	https://ta.wikinews.org/wiki?curid=2156	a3048823827bb5dfab66dcd9d53eb7a7
ta-2158	உலகத் தமிழ்ச் செம்மொழி மாநாட்டையொட்டி தமிழ் விக்கிப்பீடியாவுக்கு கட்டுரை எழுதும் போட்டி	2158	48323	https://ta.wikinews.org/wiki?curid=2158	6b4b5b79c363e5027ac44216cb895601
ta-2159	சாவகச்சேரியில் காணாமல் போன மாணவன் சடலமாக மீட்பு	2159	48324	https://ta.wikinews.org/wiki?curid=2159	095e5fe7338f183bf98339997857ff3c
ta-2160	கொங்கோவில் நூற்றுக்கணக்கானோர் படுகொலை குறித்த தகவல் வெளியிடப்பட்டது	2160	48325	https://ta.wikinews.org/wiki?curid=2160	7ca0a4a00399b4494110cedc621b95d2
ta-2161	மொஸ்கோ தொடருந்து நிலையங்களில் குண்டுவெடிப்புகள், பலர் இறப்பு	2161	48326	https://ta.wikinews.org/wiki?curid=2161	bf0481a709d49ca395dcc0d05831f24b
ta-2162	ஐக்கிய அரபு அமீரகத்தில் 17 இந்தியர்களுக்கு மரண தண்டனை விதிக்கப்பட்டது	2162	48327	https://ta.wikinews.org/wiki?curid=2162	770257bf4bd77727c8d133a794f2f1b4
ta-2167	ரியோ டின்டோ ஊழியர் நால்வருக்கு சீனா சிறைத்தண்டனை வழங்கியது	2167	48328	https://ta.wikinews.org/wiki?curid=2167	3121dc5bda211a09df59ad4380d92331
ta-2168	நளினியின் விடுதலை மனுவை தமிழக அரசு ஏற்க மறுப்பு	2168	48329	https://ta.wikinews.org/wiki?curid=2168	fcc90ee2bf38304eb3c9efe901bc90b4
ta-2171	ரசியாவின் தாகெஸ்தானில் இரட்டைக் குண்டுவெடிப்பு, 9 பேர் உயிரிழப்பு	2171	48330	https://ta.wikinews.org/wiki?curid=2171	9503287e25b791807f7f825eb579a239
ta-2172	1995 சிரெப்ரெனிக்கா படுகொலைக்கு சேர்பிய நாடாளுமன்றம் மன்னிப்புக் கோரியது	2172	48331	https://ta.wikinews.org/wiki?curid=2172	6d2d36708127ded8e58e71c0404f9b0c
ta-2178	ஆத்திரேலியாவில் புலிகளுக்கு நிதி சேகரிப்பு வழக்கில் ஈழத்தமிழர் மூவரும் விடுதலை	2178	48332	https://ta.wikinews.org/wiki?curid=2178	5b55b3b093807955c4df3c78a3769e2a
ta-2180	கினி-பிசாவு நாட்டில் ”இராணுவப் புரட்சி” முயற்சி	2180	48333	https://ta.wikinews.org/wiki?curid=2180	7b17df46fc6fa5e6d73bb3c462798a3b
ta-2185	இந்தியாவில் சிறுவர்கள் அனைவருக்கும் அடிப்படைக் கல்வி உரிமை	2185	48334	https://ta.wikinews.org/wiki?curid=2185	43a1aeb9e4ee08d4f5048416dd9b57f1
ta-2187	ரஷ்யாவின் சோயுஸ் டிஎம்ஏ-18 விண்கலம் மூவருடன் விண்ணுக்கு ஏவப்பட்டது	2187	10027	https://ta.wikinews.org/wiki?curid=2187	eff16d63a56c010272f01373179c12d4
ta-2190	காஷ்மீரில் தொடருந்துப் பாதை தீவிரவாதிகளால் தகர்ப்பு	2190	48335	https://ta.wikinews.org/wiki?curid=2190	fb9d1368d0e0074f6000d51a0dd1dca4
ta-2192	செருமானியப் படையினரின் தாக்குதலில் 5 ஆப்கானியப் படையினர் உயிரிழப்பு	2192	48336	https://ta.wikinews.org/wiki?curid=2192	80c307976ed10a4f2fd3b29389c90846
ta-2193	தமிழ்நாட்டில் மாற்றுத் திறனாளிகளுக்கு அரசுப் பள்ளிகளில் ஆசிரியர் பணி	2193	48337	https://ta.wikinews.org/wiki?curid=2193	6889084805fc6deadbe4f0515480252f
ta-2194	மக்கள் தொகை கணக்கெடுப்பில் மூன்றாம் பாலினத்தவர்களையும் சேர்க்க கருணாநிதி வலியுறுத்தல்	2194	48338	https://ta.wikinews.org/wiki?curid=2194	81313fb5f245a63ce96fbfdafa8e79b9
ta-2196	செனிகலில் பெரும் பணச்செலவில் அமைக்கப்பட்ட சர்ச்சைக்குரிய சிலை திறப்பு	2196	48339	https://ta.wikinews.org/wiki?curid=2196	2ebbbbbe3afc0168cec8b9fd153fbcd5
ta-2199	உலகின் இரண்டாவது குளோனிங் ஓட்டகம்	2199	48340	https://ta.wikinews.org/wiki?curid=2199	73cc99a69b12b7dc32c13f3568aa7b11
ta-2200	அமீரகம் - சவுதி எல்லையில் சுமையுந்து ஓட்டுநர்களின் பிரச்சினை தொடர்கிறது	2200	48341	https://ta.wikinews.org/wiki?curid=2200	c742539d4a098c479a3769d79777a9c4
ta-2203	ஒரிசாவில் மாவோயிசப் போராளிகளின் தாக்குதலில் 10 காவல்துறையினர் உயிரிழப்பு	2203	48342	https://ta.wikinews.org/wiki?curid=2203	1ab198d32f171aecea70b97b2a208bfa
ta-2207	சோயிப் மாலிக் மீது மோசடி வழக்கு	2207	48343	https://ta.wikinews.org/wiki?curid=2207	8248429924c1459d3755770335a7ec8c
ta-2209	தென்னாப்பிரிக்காவில் வெள்ளையின மேலாதிக்கவாதிகளின் தலைவர் படுகொலை	2209	48344	https://ta.wikinews.org/wiki?curid=2209	4228d8febc08b927e988a47aa8debc08
ta-2210	பெங்களூர் மாநகராட்சி தேர்தலில் பாஜக வரலாற்றுச் சாதனை	2210	48345	https://ta.wikinews.org/wiki?curid=2210	23d93ea0e9e3d1fc4a4a9186533fe285
ta-2216	விக்கிகசிவுகளில் ஈராக்கில் அமெரிக்கப் படையின் துப்பாக்கிச்சூடு காணொளி	2216	48346	https://ta.wikinews.org/wiki?curid=2216	5f71d5da973f3185c3af4d366a73f237
ta-2219	1948 மலேசியப் படுகொலைகளை நேரில் பார்த்த கடைசி சாட்சி இறப்பு	2219	48347	https://ta.wikinews.org/wiki?curid=2219	797f810ae54e80aab10803a8d423e9e8
ta-2221	நளினி விடுதலை கோர முடியாது என சென்னை உயர்நீதிமன்றம் தீர்ப்பு	2221	48348	https://ta.wikinews.org/wiki?curid=2221	81d7e9aa3e74cf09ee91660d8ccf223c
ta-2226	இந்தியாவில் மாவோயிசப் போராளிகளின் தாக்குதலில் 75 படையினர் உயிரிழப்பு	2226	48349	https://ta.wikinews.org/wiki?curid=2226	754f2bf7b3e133cc9bd35cf5604dd53e
ta-2232	அமெரிக்காவில் சுரங்க விபத்தில் 25 பேர் கொல்லப்பட்டனர்	2232	48350	https://ta.wikinews.org/wiki?curid=2232	fa276c8d6f7ae85bc665455279ceee8e
ta-2869	புரோகிரஸ் விண்கலம் விண்வெளி நிலையத்துடன் இணையும் முயற்சி தோல்வி	2869	48523	https://ta.wikinews.org/wiki?curid=2869	ddb92e0b46626ad2c00d08517332b651
ta-2870	கொங்கோவில் எண்ணெய்த் தாங்கி வெடித்ததில் இருநூறுக்கும் அதிகமானோர் உயிரிழப்பு	2870	48524	https://ta.wikinews.org/wiki?curid=2870	550a4f724865319a1bf1940dd8827180
ta-2871	கிர்கிஸ்தானின் அரசுத்தலைவராக ரோசா ஒட்டுன்பாயெவா பதவியேற்றார்	2871	48525	https://ta.wikinews.org/wiki?curid=2871	31b5a9081c2fa97dbe95ec29154f39fd
ta-2872	கால்பந்து 2010: காலிறுதிப் போட்டிகளில் அர்ஜென்டினா, பராகுவே அணிகள் தோல்வி	2872	48526	https://ta.wikinews.org/wiki?curid=2872	a9000afde9d430db7c959d196735d883
ta-2873	புரோகிரஸ் விண்கலம் விண்வெளி நிலையத்துடன் இணைய எடுத்த இரண்டாவது முயற்சி வெற்றி	2873	48527	https://ta.wikinews.org/wiki?curid=2873	a5141a047dd3a3c0c48f5a968692e7e1
ta-2878	புற்றுநோயைக் குணப்படுத்த 'வெடி குண்டு', அறிவியலாளர்கள் முயற்சி	2878	48528	https://ta.wikinews.org/wiki?curid=2878	1936ab71e264603d9ddb7f246b3fa68a
ta-2879	ஜிஎஸ்பி சிறப்பு வரிச் சலுகையை இலங்கை இழந்தது	2879	48529	https://ta.wikinews.org/wiki?curid=2879	74a1567c29f59dd81300c1f3bad6a734
ta-2880	இலங்கை அகதி விண்ணப்பங்கள் தொடர்பான தடையை ஆஸ்திரேலியா உடனடியாக நீக்கியது	2880	48530	https://ta.wikinews.org/wiki?curid=2880	89990447a16a2a37b059d40ccdcfc0fb
ta-2881	போலந்தின் அரசுத் தலைவராக புரொனிசுலாவ் கொமரோவ்ஸ்கி தெரிவானார்	2881	48531	https://ta.wikinews.org/wiki?curid=2881	37db30e6ca775e42f39c0c86fbe15c99
ta-2882	கொழும்பு ஐநா அலுவலகம் முன்னால் இரண்டாவது நாளாக ஆர்ப்பாட்டம்	2882	48532	https://ta.wikinews.org/wiki?curid=2882	f5c25bfd51f282d907a33141e7117ce4
ta-2883	டெஸ்ட் போட்டிகளில் இருந்து முரளிதரன் ஓய்வு பெறுகிறார்	2883	48533	https://ta.wikinews.org/wiki?curid=2883	432fe1d9d16d411c5df48f96952a8e43
ta-2884	கால்பந்து 2010: இறுதிப் போட்டிக்கு நெதர்லாந்து அணி தகுதி பெற்றது	2884	48534	https://ta.wikinews.org/wiki?curid=2884	f80e28464de1f3d069506d515d16a5d3
ta-2885	2010 கால்பந்து: ஸ்பெயின் ஜெர்மனியை வென்று இறுதிப் போட்டிக்குத் தெரிவானது	2885	48535	https://ta.wikinews.org/wiki?curid=2885	3accf3706999128e3d0ac2f2b2b4b623
ta-2886	மட்டக்களப்பு வாகரையில் தொல்பொருட்கள் மீட்பு	2886	48536	https://ta.wikinews.org/wiki?curid=2886	24a8dc2740948d9494012ab7e8217ba2
ta-2888	52 அரசியல் கைதிகளை விடுவிக்கவிருப்பதாக கியூபா அறிவித்தது	2888	48537	https://ta.wikinews.org/wiki?curid=2888	edb2f915318a884132c95e48fa64588c
ta-2889	சூரிய ஆற்றலில் 26 மணி நேரம் பறந்து சாதனை படைத்தது விமானம்	2889	48538	https://ta.wikinews.org/wiki?curid=2889	f2a494ef574465d8b2a25b1c645c590e
ta-2890	அமைச்சர் விமல் வீரவன்ச உண்ணாநிலைப் போராட்டத்தை ஆரம்பித்தார்	2890	48539	https://ta.wikinews.org/wiki?curid=2890	18f7f2ea86b2b5688db1c0f61b4589ac
ta-2891	மாபெரும் வாயுக்குமிழியைக் கக்கிய கருங்குழி கண்டுபிடிக்கப்பட்டது	2891	48540	https://ta.wikinews.org/wiki?curid=2891	fe2ed924a86a165ed5d3b79812c5fd6e
ta-2893	அமெரிக்காவும் உருசியாவும் உளவாளிகளைப் பரிமாறின	2893	48541	https://ta.wikinews.org/wiki?curid=2893	02ec3558d0a0db1c7e6f83f1dbf9af98
ta-2898	பாகிஸ்தான் தற்கொலைத் தாக்குதலில் நூற்றுக்கும் அதிகமானோர் உயிரிழந்தனர்	2898	48542	https://ta.wikinews.org/wiki?curid=2898	b390a9f1e2095d6f7fda831a80b6e1a4
ta-2899	விமல் வீரவன்ச தனது உண்ணாநோன்பை முடித்துக் கொண்டார்	2899	48543	https://ta.wikinews.org/wiki?curid=2899	3c50e574f544c393d1aea51a8227b286
ta-2900	ஆஸ்திரேலியப் பழங்குடிப் போர்வீரரின் உடல் 170 ஆண்டுகளுக்குப் பின்னர் அடக்கம் செய்யப்பட்டது	2900	48544	https://ta.wikinews.org/wiki?curid=2900	a716d391f68d17dc598762935eecd88a
ta-2901	2010 உலக கால்பந்து கோப்பையை ஸ்பெயின் கைப்பற்றியது	2901	12937	https://ta.wikinews.org/wiki?curid=2901	85b00dbd024fefd47f7d044ab2ae40a2
ta-2904	உகாண்டா குண்டுவெடிப்பில் கால்பந்து ரசிகர்கள் 64 பேர் கொல்லப்பட்டனர்	2904	48545	https://ta.wikinews.org/wiki?curid=2904	ac970bc04373d5e85d1ce15174e929e0
ta-2905	கொலம்பிய பார்க் தலைவரின் மெய்ப்பாதுகாவலர்கள் படையினரின் தாக்குதலில் கொல்லப்பட்டனர்	2905	48546	https://ta.wikinews.org/wiki?curid=2905	b7213074d46fbc49de83a1ac54105b74
ta-2906	சூடான் அரசுத் தலைவர் பசீர் மீது இரண்டாவது சர்வதேசப் பிடியாணை	2906	48547	https://ta.wikinews.org/wiki?curid=2906	56e9f27b46b978c89ba2196331260a8f
ta-2907	ஆஸ்திரேலியத் தூதரை பிஜி வெளியேற்றியது	2907	10060	https://ta.wikinews.org/wiki?curid=2907	96b6ad39453681067a404f96d764748a
ta-2908	ரோமான் பொலான்ஸ்கி அமெரிக்காவிற்கு நாடு கடத்தப்பட மாட்டார் என சுவிஸ் அறிவிப்பு	2908	10401	https://ta.wikinews.org/wiki?curid=2908	bd3c7fb9ee195aa34ba010ab0021b6fc
ta-2913	பிரான்சில் இசுலாமியப் பெண்கள் முழு முகத்திரை அணியத் தடை	2913	48548	https://ta.wikinews.org/wiki?curid=2913	e440b154272d8ff2c934e02c612f5ddd
ta-2916	இலங்கை அமைச்சரவைக் கூட்டம் கிளிநொச்சியில் நடந்தது	2916	48549	https://ta.wikinews.org/wiki?curid=2916	32da2aff8a78139728134885236846d7
ta-2918	ஈரான் பள்ளிவாசல் தற்கொலைத் தாக்குதலில் 22 பேர் உயிரிழப்பு	2918	48550	https://ta.wikinews.org/wiki?curid=2918	73f0c7e56ce682779188d80e55f0daa1
ta-2919	இந்திய ரூபாய்க்கு புதிய அடையாளக் குறியீடு அறிமுகம்	2919	48551	https://ta.wikinews.org/wiki?curid=2919	f57aaa09455ac6637888bfcc357a2c9c
ta-2920	மூத்த கருநாடக இசைப் பாடகர் ஒ.வி.சுப்பிரமணியம் காலமானார்	2920	48552	https://ta.wikinews.org/wiki?curid=2920	a5bc4bee084f5100e6a1717ae71a2fa9
ta-2921	ஆஸ்திரேலியாவில் பொதுத்தேர்தல் அறிவிக்கப்பட்டது	2921	48553	https://ta.wikinews.org/wiki?curid=2921	296e691558bc79c6b18b9e70db0e2b01
ta-2922	தேசிய பாதுகாப்புச் சட்டத்தின் கீழ் நாம் தமிழர் இயக்கத் தலைவர் சீமான் கைது	2922	48554	https://ta.wikinews.org/wiki?curid=2922	30cea001c3c5506e107b861735ca2721
ta-2924	நைஜீரியாவில் மத வன்முறைகளில் எட்டு கிறித்தவர்கள் படுகொலை	2924	48555	https://ta.wikinews.org/wiki?curid=2924	37dca40e2731ebbca47e5cec2fdc76a4
ta-2925	மாயன் மன்னரின் கல்லறை குவாத்தமாலாவில் கண்டுபிடிக்கப்பட்டது	2925	48556	https://ta.wikinews.org/wiki?curid=2925	6565941451c3dd41ea152deabed6caab
ta-2927	மேற்கு வங்கத்தில் இரண்டு தொடருந்துகள் மோதியதில் 60 பேர் உயிரிழந்தனர்	2927	48557	https://ta.wikinews.org/wiki?curid=2927	1767b1a782e05b2bbfd772d06897b089
ta-2929	சூடானில் இடம்பெற்ற மோதல்களில் 75 படையினர், 300 போராளிகள் உயிரிழப்பு	2929	48558	https://ta.wikinews.org/wiki?curid=2929	4b08bd109192a2f9c0d1c0b581c78045
ta-2930	காரைதீவில் தமிழ்ச் செம்மொழி விழா	2930	48559	https://ta.wikinews.org/wiki?curid=2930	f3d5cb86b6abf6c7d2bfc8483a5f01dc
ta-2931	பிரித்தானிய எழுத்தாளர் சிங்கப்பூரில் கைது	2931	48560	https://ta.wikinews.org/wiki?curid=2931	940150967deb769f8e2a4b1a77224e4a
ta-2934	65 ஆண்டுகளாக அழிந்துவிட்டதாக கருதப்பட்ட தேவாங்கு இலங்கையில் கண்டுபிடிப்பு	2934	48562	https://ta.wikinews.org/wiki?curid=2934	1b34d4677eecb4f10480b02771d3590b
ta-2935	முரளிதரன் தேர்வுத் துடுப்பாட்டத்தில் 800 இலக்குகளை வீழ்த்தி உலக சாதனை	2935	48563	https://ta.wikinews.org/wiki?curid=2935	20f7dcbd17d12f69ced48c7ced43c1c3
ta-2937	கொசோவோ விடுதலை சட்டபூர்வமானது என பன்னாட்டு நீதிமன்றம் தீர்ப்பு	2937	48564	https://ta.wikinews.org/wiki?curid=2937	ead27e9307224831f1191803b395a251
ta-2939	விண்மீனைச் சுற்றி கரிம 'விண்பந்துகள்' கண்டுபிடிக்கப்பட்டன	2939	48565	https://ta.wikinews.org/wiki?curid=2939	b99d63c6e811f52c01a3770da36cb9b2
ta-2942	நீளலகு நாணல் கதிர்க்குருவிகளின் இனப்பெருக்கும் இடம் தஜிகிஸ்தானில் கண்டுபிடிக்கப்பட்டது	2942	48566	https://ta.wikinews.org/wiki?curid=2942	29cdbf108551cfc452c3c8bc81affef1
ta-2943	கறுப்பு ஜூலை நினைவு நிகழ்வுகள்: லண்டனில் இருந்து ஜெனீவா நோக்கி நடைப்பயணம்	2943	48567	https://ta.wikinews.org/wiki?curid=2943	0f516477550875158f59802cc8b4b1bc
ta-2946	செருமனியில் இசை விழா ஒன்றில் ஏற்பட்ட நெரிசலில் 19 பேர் உயிரிழந்தனர்	2946	48568	https://ta.wikinews.org/wiki?curid=2946	7fe7767f4167fe8013bd57f0b87ea528
ta-2947	ஆப்கானிஸ்தானில் இரண்டு அமெரிக்கப் படையினரை தலிபான்கள் பிடித்தனர்	2947	48569	https://ta.wikinews.org/wiki?curid=2947	11ca41ae7e931479a6a41fec04cd09c1
ta-2948	கெமரூச் முன்னாள் சிறைச்சாலை அதிகாரிக்கு 35 ஆண்டுகள் சிறைத்தண்டனை	2948	48570	https://ta.wikinews.org/wiki?curid=2948	9c37efed10bd46b56fc87e5cb7ea2670
